शीर्षक,विवरण
चलचित्र ‘जन्ते बाख्रो’को प्रिमियर सम्पन्न,"काठमाडौं, २२ जेठ । यही जेठ २३ गतेदेखि प्रदर्शनमा आउने चलचित्र जन्ते बाख्रोले भव्य प्रिमियर सम्पन्न गरेको छ । बुधबार काठमाडौंको सिभिल मलमा चलचित्र जन्ते बाख्रोको प्रिमियर गरिएको हो । प्रिमियरमा कलाकारहरु सौगात मल्ल, गरिमा शर्मा, सन्दीप क्षेत्री, लाहुरे, अनुपविक्रम शाही, वर्षा राउत, सञ्जोग कोइराला, अशिम शाह, महेश काफ्ले, लोकेन्द्र लेखकलगायतका कलाकारहरुको बाक्लो उपस्थित थियो । प्रिमियरपछि पत्रकारहरुसँग कुरा गर्दै गायक महेश काफ्लले चलचित्रको कथा सरर बगेकोले राम्रो लागेको भन्दै आमाको भुमिकामा रहेकी रमा थपलियाको अभिनयको तारिफ गरे ।  ‘कथा बगेको छ । यसको महत्वपूर्ण पाटो पनि कथा बग्नु नै हो । चलचित्रमा सबै गित संगित एकदम राम्रो छ । सौगात दाईको ममिको भुमिका निभाउनु भएको रमा थपलिया ज्यू उहाँको एकदम राम्रो गर्नुभएको छ । समग्रमा राम्रो छ,’ उनले भने । यस्तै, कलाकार लोकेन्द्र लेखकले टिम राम्रो हुदाँ नै चलचित्र राम्रो बन्ने भन्दै यो टिमले राम्रो चलचित्र बनाएको बताए । उनले भने, ‘जब टिम राम्रो भइदिए पछि सबै राम्रो हुन्छ जस्तो लाग्छ । अहिले हामीले कन्टेन मात्र भनिरहेका छौँ । कहिलेकाही कन्टेनको बिचमा मनोरञ्जन, पारिवारिक चलचित्र जो सबैले हेर्न मिल्छ । २ घण्टाको समयमा बच्चादेखि बुढासम्म सबैले मनोरञ्जन लिएर खुसी हुँदै बाहिर जाउन् भन्ने यो प्रयास हो ।’ उनले थप भने, ‘यसमा टिम नै राम्रो भएर पनि अव यो मिस हुनेवाला छ ।’। यसैगरी, प्रिमियरमा पुगेका वर्षा राउत र सञ्जोग कोइरालाले पनि लामो समयपछि रमाइलो चलचित्र हेर्न पाएको बताए । "
चलचित्र सेन्सर बोर्डको सदस्यमा गिरी नियुक्त,"काठमाडौं, २२ जेठ । केन्द्रीय चलचित्र जाँच समिति (सेन्सर बोर्ड)को सदस्यमा रंग पत्रकार कुबेर गिरी नियुक्त भएका छन् । सञ्चार तथा सूचना प्रविधि मन्त्रालयको मन्त्रीस्तरीय निर्णयबाट गिरीलाई सदस्य नियुक्ति गरिएको हो । गिरीलाई सञ्चार तथा सुचना प्रविधिमन्त्री पृथ्वीसुब्बा गुरुङले बोर्ड सदस्यको नियुक्ति पत्र दिएका हुन् । दुई दशकदेखि रंग पत्रकारितामा सक्रिय गिरी विभिन्न साप्ताहिक, मासिक, समाचारपत्र, हिमालयन टाइम्स, सौर्य दैनिक र नेपाल टेलिभिजनको चलचित्र समाचार हुँदै पछिल्लो एक दशकदेखि रातोपाटी डटकममा कार्यरत रहेका छन् । नेपाल टेलिभिजनका लागि करिब आधा दर्जन टेलिसिरियल, चलचित्रसम्बन्धी कार्यक्रम समेत निर्माण, निर्देशन गरेका गिरीले केही म्युजिक भिडियोको समेत निर्देशन गरेका छन् । गिरी चलचित्र पत्रकार संघका केन्द्रीय उपाध्यक्ष पनि हुन् । त्यस्तैगरी, जाँच समिति (सेन्सर बोर्ड) सदस्यमा कलाकार भीमा मैनाली नियुक्त भएकी छन् । दुई दशक लामो फिल्म करिअरमा मैनालीले कलाकार, लेखक र निर्देशक भएर काम गरेकी छन् । उनले चलचित्र विकास बोर्डको अध्यक्ष पदमा समेत आवेदन दिएकी थिइन् । यसअघि समितिको सदस्यमा सम्पन्न श्रेष्ठ नियुक्त भएका छन् । "
‘नक्कली प्रचण्ड’ बनेका कलाकार गौतमको निधन,"काठमाडौं, २० जेठ । ‘नक्कली प्रचण्ड’का रूपमा चिनिएका कलाकार घनश्याम गौतमको निधन भएको छ । लामो समयदेखि भक्तपुरको क्यान्सर अस्पतालमा उपचार गराइरहेका गौतमको सोमबार राति निधन भएको हो । उनी भक्तपुर ताथलिमा रहेको काठमाडौं क्यान्सर अस्पतालमा लामो समयदेखि उपचार गराइरहेका थिए । ‘मेरी बास्सै’ टेलिश्रृंखलामा माओवादी अध्यक्ष एवम् पूर्वप्रधानमन्त्री पुष्पकमल दाहाल ‘प्रचण्ड’को व्यंग्यात्मक भूमिका निर्वाह गरी चर्चामा आएका थिए । "
विवादमा फस्ने डरले चलचित्र ‘जनै हराएको बाहुन’को नाम परिवर्तन,"काठमाडौं, १९ जेठ । चलचित्र ‘जनै हराएको बाहुन : सम्बन्धका धागाहरू’को नाम परिवर्तन भएको छ । अब यो चलचित्रको नाम ‘जनै हराएको मान्छे : सम्बन्धका धागाहरू’ रहने भएको हो । हिन्दु धर्मसँग सम्बन्धित केही व्यक्ति तथा संस्थाले नाममा चासो देखाएपछि विवादमा फस्न नचाहेकाले बाहुनको ठाउँमा मान्छे राखिएको निर्माणपक्षले जनाएको छ । भदौ ६ गते रिलिज हुने यस चलचित्रको नाम परिवर्तन गर्दै निर्माणपक्षले मुख्य पात्रको क्यारेक्टर पोस्टर पनि सार्वजनिक गरेको छ । पोस्टरमा मुख्य पात्र विजय बराल छन् । रातो सटमा दुईवटा झोला बोकेर घरबाट निस्किन लागेको जस्तो देखिन्छ । आमाले रातो टीका लगाइदिएर घरबाट निस्किने बेलामा आर्शिवाद दिएको जस्तो देखिएको छ । पोस्टरको कलरले बिहानको समय रहेको संकेत गरेको छ । उनको निन्यनउरो अनुहारले घरपरिवार र आफन्तसँग छुट्नुपर्दाको पीडा देखाउँछ । पोस्टरले गाउँको व्यक्तिले गाउँ छोडेर सहर पुगेर गरेको संघर्ष बताउने संकेत गरेको छ । निर्माणपक्षले विजयलाई एउटा ट्याग दिएको छ । विजयलाई निर्माणपक्षले ‘एपिक नेचुरल स्टार’को ट्याग दिएको हो । छायांकन सकिएको यो चलचित्र अहिले पोस्टप्रोडक्सनको टेबुलमा छ । यो चलचित्र छायांकन काठमाडौं, ललितपुर, भक्तपुर र काभ्रेमा गरिएको थियो । निर्देशक हिमाल न्यौपानेले ‘जनै हराएको मान्छे : सम्बन्धका धागाहरू’ले आमा र छोराबीचको भावनात्मक कथा भन्ने बुझिएको छ । चलचित्रको असोसियट निर्देशकमा ‘प्रेमगीत ३’ अभिनेता मनिष राउत छन् । बलियो लाइनअप देखिएको चलचित्रमा अभिनेता विजय बरालसँगै अभिनेत्री केकी अधिका, अभिनेत्री मिरुना मगर, गौरव पहाडी, सुशांक मैनाली र भोलाराज सापकोटाको मुख्य भूमिका छ । चलचित्रमा रियर राई, भावना खपांगी मगर, रुपेश लामा, सुमन थापा लागायतको पनि अभिनय रहेको छ । पेपरक्लिपको ब्यानरमा निर्माण भएको चलचित्रका निर्माता कमल न्यौपाने र विमल न्यौपाने हुन् । सहनिर्मातामा आरके मानन्धर, रुपेश लामा, सिआर बस्नेत, नारायण तिमिसिना र चुडामणि सिवाकोटी रहेका छन् । थानेश्वर गौतम, अर्जुन पोखरेल, एसडी योगी र प्रसान्त सिवाकोटीको संगीत रहेको चलचित्रमा नवीन गुरुङ डीओपी र कृष्ण परियारको सिनेमेटोग्राफी रहेको छ । चलचित्रको कथा, पटकथा र संवाद भानुभक्त ढकालले लेखेका हुन् । दिनेश बहादुर राउत मुख्य सहायक निर्देशक रहेको सिनेमामा तर्कराज न्यौपाने, रविन्द्र नेपाल, मोनिका थापा र आकाश के।सी सहायक निर्देशक रहेका छन् । चलचित्रका निर्माण नियन्त्रक लक्ष्मण राज पौडेल हुन् । गोविन्द शाहीको काफिया फिल्मस्ले वितरणको जिम्मा लिएको चलचित्र ‘जनै हराएको बाहुन : सम्बन्धका धागाहरू’ भदौ ६ गते रिलिज हुनेछ । अल टाइम ब्लक बस्टर चलचित्र ‘पूर्णबहादुरको सारंगी’ पछि विजय बरालको मुख्य भूमिकामा आउन लागेको यस वर्षको यो पहिलो चलचित्र हो । यस्तै, विसं. २०८१ मा नेपाली चलचित्र उद्योगलाई ब्लकबस्टर सिनेमा दिने विजय र केकी ‘जनै हराएको बाहुन : सम्बन्धका धागाहरू’को मुख्य भूमिकामा सँगै देखिँदै छन् । "
गायक तथा संगीतकार गणेश रसिकको निधन,"काठमाडौं, १८ जेठ । गायक तथा संगीतकार गणेश रसिकको निधन भएको छ । उनको आज ७७ वर्षको उमेरमा हात्तीवनस्थित नेपाल क्यान्सर अस्पतालमा निधन भएको हो । उनी क्यान्सर रोगबाट पीडित थिए । उनको भोलि मात्रै अन्त्येष्टि गरिने बताइएको छ । छोरी विदेशमा रहेकाले भोलि मात्रै अन्त्येष्टि गर्न लागिएको हो । "
फिल्म ‘जन्ते बाख्रो’को टिम प्रचारप्रसारमा,"काठमाडौं, १८ जेठ । यही जेठ २३ गतेदेखि प्रदर्शनमा आउन लागेको नेपाली चलचित्र ‘जन्ते बाख्रो’ टिमले प्रचार प्रसारका लागि ‘जन्ते बाख्रो साँझ’ कार्यक्रम भव्यताका साथ सम्पन्न गरेको छ । शनिबार सिटी स्क्वायर मल सामाखुशीको प्राङ्गणमा ५ बजेदेखि साँझ अवेरसम्म विभिन्न कलाकारहरुले ‘जन्ते बाख्रो साँझ’मा आफ्ना प्रस्तुति देखाएका छन् । दर्शकहरुको बाक्लो उपस्थितिले धेरै खुसी लागेको चलचित्र जन्ते बाख्रोकी नायिका गरिमा शर्माले बताइन् । उनले भनिन्, ‘यहाँ जति साँझ हुँदै गयो त्यती माहोल तात्दै जान्छ, आज उत्साहीत छु आज आउनुभएका दर्शकहरु २३ गते फिल्म हेर्न आउनुभयो भने हाम्रो फिल्म सफल हुनबाट कसैले रोक्न सक्दैन ।’ उनले सबैलाई जन्ते बाख्रो हेरी प्रतिक्रिया दिन आग्रह गरिन् । यस्तै, कलाकार विशाल पहाडीले जन्ते बाख्रो साँझले दर्शकलाई फिल्म हलसम्म तान्ने बताए । उनले भने, ‘उहाँहरुले फिल्म नहेरी केही भन्न सक्नुहुन्न् । उहाँहरुलाई फिल्म हलसम्म लानु नै हाम्रो उद्देश्य हो । त्यसपछि आशा छ पक्कै मन पराउनुहुन्छ ।’। चलचित्रमा अभिनेता सौगात मल्ल, आशिफ शाह, गरिमा पन्त, रमा थपलिया, लोकेन्द्र लेखक, कमल देवकोटा, विशाल पहाडी, रुशा न्यौपाने, कुसुम शर्मा, स्नेहा जोशी, समापिका गौतमलगायत कलाकारले अभिनय गरेका छन् । यो चलचित्रको कथा, पटकथा र संवाद लेखक प्रदीप भारद्वाजले लेखेका हुन् । "
नमिता दवाडीको ‘म त एक्लै ज्यूँछु बरु’मा एलिना,"काठमाडौं, १७ जेठ । गीतकार नमिता दवाडीको ‘म त एक्लै ज्यूँछु बरु’ बोलको गीतको म्युजिक भिडियो सार्वजनिक भएको छ । गायिका एलिना चौहानको स्वरमा रहेको गीतमा ज्ञानेन्द्र गिरीको कम्पोज, विशाल निरौलाको एरेन्ज, नरेश बिबिसीको मिक्सिङ तथा मास्टरिङ रहेको छ । प्रेम वियोगमा रहेकी युवतीको प्रेमगाथा बोल्ने म त एक्लै ज्यूँछु बरुमा एलिना गज्जबसँग खुलेकी छन् । आफूलाई भन्दा बढी माया गरेको मान्छेले रुवाएर दुनियाँको अघि हाँसोको पात्र बनाएपछि प्रेम वियोगमा परेकी युवतीले एक्लै जिउने चाहना राखेको विषयलाई निर्देशक आयुष क्षेत्री प्रिन्सले कलात्मक शैलीमा प्रस्तुत गरेका छन् । भिडियोमा गायिका एलिना चौहानकै अभिनय देख्न सकिन्छ । सुबिन गोदारको छायांकन रहेको भिडियोको सम्पादन तथा कलर कल्पेश विश्वकर्माले गरेका हुन्। गीतको चर्चासँगै टिकटक र रिल्स पनि उल्लेख्य बनिरहेको गीतकार दवाडीले बताइन् । नेपाली गीत संगीत र साहित्यको क्षेत्रमा सक्रिय गीतकार दवाडीले परवासमा रहेर पनि लेखनको क्षेत्रमा क्रियाशीलता देखाइरहेकी छन् । उनका पारालिङ्गीहरूमा समर्पित परिचय, मलाई बाँच्न सिकायौँ जस्ता गीत चर्चामा छन् । सार्वजनिक गीतको निर्माताका रुपमा निमिसा दवाडी रहेकी छन् । "
