शीर्षक,विवरण
टेक्सस राज्य संसदद्वारा १३ मार्चलाई ‘नेपाली लुम्बिनी एड्भोकेसी डे’ घोषणा,"टेक्सस, २ चैत । अमेरिकाको टेक्सस राज्य संसद्ले १३ मार्चलाई ‘नेपाली लुम्बिनी एड्भोकेसी डे’ घोषणा गरेको छ । टेक्सास राज्य संसद्को प्रतिनिधिसभाको १३ मार्च बिहीबार सम्पन्न बैठकले ‘नेपाली लुम्बिनी एड्भोकेसी डे’को मान्यता दिने सङ्कल्प प्रस्ताव ५३० पारित गर्दै घोषणा गरेको हो । सङ्कल्प प्रस्ताव पारित भएपछि टेक्सस राज्य संसद्बाट ‘नेपाली लुम्बिनी एड्भोकेसी डे’ले औपचारिक मान्यता पाएको छ । ‘नेपाली लुम्बिनी एड्भोकेसी डे’सम्बन्धी प्रस्ताव पाकिस्तानीमूलका टेक्ससका राज्य सांसद सुलेमान लालानीले संसद् बैठकमा पेस गरेका थिए । यो प्रस्ताव संसद् बैठकबाट पारित हुँदा अमेरिका भ्रमणमा रहेका नेपालको लुम्बिनी सर्किटअन्तर्गत पर्ने पाँच वटा नगरपालिकाका मेयरहरू पनि उपस्थित थिए । प्रस्तावमा लुम्बिनीलाई बौद्धधर्मका लागि एक अत्यन्त पवित्रस्थल भएको भन्दै सिद्धार्थ गौतमको जन्मस्थलको रूपमा मान्यता प्राप्त रहेकोमा विशेष जोड दिइएको छ । यस क्षेत्रलाई संयुक्त राष्ट्रसङ्घीय शैक्षिक, वैज्ञानिक तथा सांस्कृतिक सङ्गठन (युनेस्को)को विश्व सम्पदा सूचीमा सूचीकृत गरिएको तथा बौद्ध धर्मावलम्बीको प्रमुख आध्यात्मिक गन्तव्य रहेको उल्लेख गरिएको छ । टेक्सासको ८९ औँ संसद्को प्रतिनिधिसभाले मार्च १३, २०२५ लाई ‘नेपाली लुम्बिनी एड्भोकेसी डे’ को रूपमा औपचारिक मान्यता दिएको र लुम्बिनीको प्रचार प्रसारको लागि भ्रमण गर्ने नेपाली मेगरहरुको प्रतिनिधिमण्डललाई हार्दिक स्वागत गर्ने समेत सङ्कल्प प्रस्तावमा उल्लेख गरिएको छ । लुम्बिनी सर्किटअन्तर्गतका पाँच वटा नगरपालिकाका मेयरहरूसहितको प्रतिनिधिमण्डल अमेरिकाको टेक्ससमा रहेको अवसरमा गैरआवासीय नेपाली सङ्घ अमेरिकाका उपाध्यक्ष तथा पर्यटन विभागमा प्रमुख नेत्र पाण्डे, नागरिक अगुवा प्रभात दीक्षितले सङ्कल्प प्रस्ताव पारित गराउन पहल गरेका थिए । नेपालको पर्यटन प्रवर्द्धनमा सहयोग पुर्‍याउने उद्देश्यले हरेक वर्ष १३ मार्चमा टेक्सस राज्यमा नेपाली समुदायको तर्फबाट ‘नेपाली लुम्बिनी एड्भोकेसी डे’ मनाइने गैरआवासीय नेपाली सङ्घ अमेरिकाका उपाध्यक्ष तथा पर्यटन विभागमा प्रमुख नेत्र पाण्डेले बताए । "
प्रवासी नेपाली मञ्चका उपसचिव चानक पोखरेल सम्मानित,"कतार, २४ फागुन । प्रवासी नेपाली मञ्च अन्तर्राष्ट्रिय कमिटीका उपसचिव चानक पोखरेल कतारमा सम्मानित भएका छन् । विगत लामो समयदेखि दोहामा रही निरन्तर, सामाजिक कार्यमा सक्रिय रहेका सामाजिक तथा कुशल राजनीतिक व्यक्तित्व पोखरेल दोहामा सम्मानित भएका हुन् । मोरङ–सुनसरी सेवा समाज कतारको २५औं स्थापना दिवसको अवसरमा आयोजना गरिएको कार्यक्रममा पोखरेललाई दोसल्लासहित मायाको चिनो प्रदान गरी सम्मानित गरिएको हो । सन् २००१ मा स्थापित मोरङ–सुनसरी सेवा समाज कतारको संस्थापक महासचिव, संस्था स्थापनादेखि हालसम्म गरेको भूमिकाको उच्च कदर गर्दै २५औं स्थापना दिवसको अवसरमा पोखरेललाई सम्मान गरिएको संथाले जनाएको छ । कार्यक्रममा कतारका लागि नेपाली राजदूत रमेशचन्द्र पौडेल, सामाजिक व्यक्तित्व कमलमणि गुरागाईँ, सागर नेपाल, एनआरएनए कतार अध्यक्ष रमेश भट्ट, अध्यक्ष भीम बराइली, कोशी प्रदेशका सबै जिल्लाका नेताहरु सहभागी थिए । कार्यक्रममा समाजसेवी पोखरेलले आफूलाई सम्मानित गरेर संस्थाले नेपाली श्रमिकको पक्षमा काम गर्न थप हौसला प्रदान गरेको बताए । जुन समय दोहामा दूतावास थिएन, त्यो बेला नेपाली मजदुरका हक, हित, अधिकारको निम्ति संस्था स्थापना गरिएको र आजसम्म पनि संस्थाले सक्रियताका साथ सामाजिक, आर्थिक कार्यहरु निरन्तरता दिएको भन्दै उनले खुशी पनि व्यक्त गरे । आफूलाई सम्मान गरिएकोमा मोरङ–सुनसरी सेवा समाज कतारको सम्पूर्ण टिमप्रति हार्दिक कृतज्ञता व्यक्त गर्दै पोखरेलले आफूले सक्दो, समयले साथ दिएसम्म संस्थालाई सहयोग गर्ने प्रतिवद्धता व्यक्त गरे । कार्यक्रममा राजदूत पौडेललगायतका वक्ताहरुले प्रवासमा रहेका नेपालीको समस्या समाधान र कतारमा रहेका श्रमिकको हित केन्द्रित अभियानको विषयमा आफ्नो धारणा राखेका थिए । "
अमेरिकाले पनामाको होटलमा राख्यो नेपालीसहित ३ सय बढी आप्रावासी,"पनामा, ९ फागुन । अमेरिकामा डोनाल्ड ट्रम्पले राष्ट्रपति बने लगत्तै धेरै ठूला निर्णय लिइरहेका छन् । जसमध्ये एउटा हो, अमेरिकामा गैरकानुनी रूपमा बसेका मानिसहरूलाई आफ्नो देशमा फिर्ता पठाउने । यसका लागि अमेरिकाले काम पनि सुरू गरिसकेको छ । यसैबीच केही तस्वीरहरु बाहिर आएका छन्, जसले भावुक बनाउँछ । समाचार अनुसार पनामाको एउटा होटलमा करिब ३०० जना आप्रावासीलाई राखिएको छ । यी तस्वीरहरू ती व्यक्तिका हुन्, जसको हातमा ‘हामीलाई मद्दत गर्नुहोस्’ लेखिएको कागज देखिन्छ । अमेरिकी राष्ट्रपति ट्रम्पको प्रशासनले पानामाको एक होटलमा करिब ३०० आप्रवासीलाई हिरासतमा लिएर राखेको हो । यी मानिसहरूलाई कडा सुरक्षामा राखिएको छ । होटल मुनी कडा प्रहरी पहरा राखिएको छ, जसका तस्वीरहरु सामाजिक सञ्जालमा भाइरल भइरहेका छन् । तस्वीरमा होटल भित्र मानिसहरु सहयोगको याचना गरिरहेको देख्न सकिन्छ । पोस्टरमा ‘कृपया हामीलाई मद्दत गर्नुहोस्’ र ‘हामी यहाँ सुरक्षित छैनौँ’ जस्ता ब्यानर देखिएको छ । यसबारे अधिकारीहरूले हिरासतमा रहेका आप्रवासीमध्ये ४० प्रतिशत अझै पनि आफ्नो देश फर्कन तयार नभएको बताएका छन् । अमेरिकी सरकारले उनीहरुलाई फिर्ता नगए सम्म उनीहरुलाई होटलमा राख्ने निर्णय गरेको छ । मिडिया रिपोर्टका अनुसार यी ३०० आप्रवासीमध्ये धेरैजसो भारत, नेपाल, श्रीलंका, पाकिस्तान, अफगानिस्तान, चीन, भियतनाम र इरानका नागरिकहरू रहेका छन् । अमेरिकाले यी मध्ये केही देशबाट निर्वासन प्रक्रियामा केही समस्याहरू सामना गरिरहेको छ । यी मानिसहरू सबै समस्या समाधान नभएसम्म यस होटलमा बस्नेछन् । पनामाका सुरक्षामन्त्री फ्रान्क एब्रेगोका अनुसार यस विषयमा बाहिर आएको छ । जसमा उनले यी मानिसहरूलाई आफ्नो स्वतन्त्रताबाट वञ्चित नगरिएको बरु आफ्नै सुरक्षाका लागि हिरासतमा लिएको बताएका छन् । एब्रेगोले आप्रवासन सम्झौताअन्तर्गत सबैलाई उचित चिकित्सा सहायता र खाना र पानी उपलब्ध गराइएको बताए । "
ब्रिटिस कोलम्बियाको सरेमा मोबाइल कन्सुलर क्याम्प,"काठमाडौं, ८ फागुन । ओटावास्थित नेपाली दूतावासद्वारा हालै क्यानडाको ब्रिटिस कोलम्बिया प्रान्तको सरेमा मोबाइल कन्सुलर क्याम्प सञ्चालन गरिएको छ । शिविर हिन्दू बौद्ध फाउन्डेसन अफ क्यानडा, नेपाल कल्चरल सोसाइटी अफ ब्रिटिस कोलम्बिया, गैरआवासीय नेपाली संघ क्यानडा र त्यस प्रान्तमा रहेका नेपाली र अन्य सामुदायिक संस्थाहरूसँगको सहकार्यमा सञ्चालन गरिएको दूतावासले आज जनाएको छ । शिविरमा नेपाली नागरिकहरू, विशेष गरी क्यानडाको ब्रिटिस कोलम्बिया, सास्काचेवान, मनिटोबा र अल्बर्टा प्रान्तहरूमा रहेका नेपाली विद्यार्थीहरूले राहदानी नवीकरण र अन्य कन्सुलर सेवा प्रदान गरिएको थियो । केही समयदेखि दूतावासले नेपाली समुदाय र विद्यार्थी रहेका प्रान्तहरूको नजिक शिविरमार्फत यस्तो सेवा प्रदान गर्दै आएको दूतावासले जारी गरेको प्रेस विज्ञप्तिमा जनाइएको छ । साथै, दूतावासले भ्यानकुभरमा रहेका नेपाली उद्यमीहरूसँग पनि छलफल कार्यक्रम आयोजना गरेको छ । क्यानडाका लागि नेपालका राजदूत भरतराज पौड्यालले उद्यमीहरूलाई आफ्नो विशिष्ट सीप, विशेषज्ञता र सम्भावनाहरूलाई मातृभूमिको समृद्धिको लागि पनि प्रयोग गर्न अनुरोध गरे । नेपाल सरकारले गरेका नीतिगत सुधारबारे जानकारी दिँदै उनले उद्यमीहरूलाई नेपाल र क्यानडाबीच व्यापार प्रवद्र्धन गर्न र नेपालमा प्रविधि र लगानी पुर्‍याउन आग्रह गरे । "
भारतमा रेल दुर्घटनामा मृत्यु हुने नेपालीको संख्या ७ पुग्यो (नामावलीसहित),"काठमाडौं, ११ माघ । भारतको महाराष्ट्रमा भएको रेल दुर्घटनामा मृत्यु हुने नेपालीको संख्या ७ पुगेको छ । परराष्ट्र मन्त्रालयले आज विज्ञप्ति जारी गर्दै ७ जना नेपालीको मृत्यु भएको पुष्टि गरेको हो । मृत्यु हुनेमा कैलालीका कमला नवीन भण्डारी, लछिराम पासी, अछामका हिमु नन्दराम विश्वकर्मा, नन्दराम पद्म विश्वकर्मा, मैसारा कामी विश्वकर्मा, जोक्ला उर्फ कला कामी र बाँकेका राधेश्याम राध रहेका छन् । यस्तै दुर्घटनामा थप ४ जना नेपाली घाइते समेत भएका छन् । रेल दुर्घटनामा अन्य पाँचजना भारतीयको पनि मृत्यु भएको छ । "
सिटिजन्स् बैंक र लाईफ क्युइस्ट क्लिनिकल ल्याबबीच समझदारी,"काठमाडौं, २१ जेठ । सिटिजन्स् बैंक इन्टरनेसनल लिमिटेड र पानीपोखरी, काठमाडौं स्थित लाईफ क्युइस्ट क्लिनिक ल्याब प्रा.ली.बीच सिटिजन्स बैंकका ग्राहकहरूलाई विशेष छुट दिने समझदारी पत्रमा हस्ताक्षर भएको छ । सो समझदारी पत्र अनुसार सिटिजन्स् बैंकका कार्डबाहक र मोबाइल बैंकिङ्ग ग्राहकहरूले लाईफ क्युइस्ट क्लिनिक ल्याब प्रा।ली मा २० प्रतिशत सम्मको आकर्षक छुट पाउनेछन् । यस किसिमको सहकार्यबाट बैंकका ग्राहकहरु लाभान्वित हुनुका साथै नगद कारोबारबाट डिजिटल कारोबार तर्फ उत्प्रेरित हुने विश्वास बैंकले लिएको छ । बैंकले डिजिटल बैंकिङ्ग माध्यमहरुको प्रयोगलाई बढाउन र ग्राहकहरुलाई डिजिटल माध्यमबाट भुक्तानी गर्न प्रोत्साहन गर्न समय समयमा ग्राहकमैत्री सुविधाहरु सञ्चालनमा ल्याउँदै आएको छ । डिजिटल कारोबार गर्दा पाइने छुट सम्बन्धी विस्तृत विवरणहरू सिटिजन्स् बैंकको वेबसाइटमा प्राप्त गर्न सकिनेछ । "
नबिल बैंकलाई ‘द बैंकर्स टेक्नोलोजी अवार्ड २०२५’ प्रदान,"काठमाडौं, २१ जेठ । नबिल बैंकलाई एसिया–प्रशान्त क्षेत्रका लागि ‘द बैंकर्स टेक्नोलोजी अवार्ड २०२५’ प्रदान गरिएको छ । बैंकिङ क्षेत्रमा नवप्रवर्तन, डिजिटल चुस्तता र नेतृत्व क्षमताका आधारमा दिइने यो पुरस्कार अन्तर्राष्ट्रिय बैंकिङ क्षेत्रमा प्रतिष्ठित मानिन्छ । विश्वप्रसिद्ध फाइनान्सियल टाइम्स समूहअन्तर्गतको द बैंकर्सले प्रदान गर्ने यो अवार्ड नबिल बैंकले अपनाएको प्रविधिमैत्री सोच, दृष्टिकोण र ग्राहकको अनुभवमा ल्याएको डिजिटल क्रान्तिमा गरेको कामको मूल्यांकनका आधारमा प्रदान गरिएको नबिल बैंकका कामु प्रमुख कार्यकारी अधिकृत मनोजकुमार ज्ञवालीले बताए । ‘यो अवार्डले बैंकको सेवालाई अझ प्रविधिमैत्री तथा ग्राहकमैत्री बनाउन प्रोत्साहन मिलेको छ,‘ उनले भने । नबिल बैंकले आफ्नो स्थापनाकाल देखि नै प्रविधिलाई प्राथमिकतामा राखेको बताउँदै उनले भने, ‘नबिलले बैंकिङ क्षेत्रमा प्रविधिको प्रयोग गर्दै नयाँ आयाम थप्दै सेवाग्राहीलाई सुविधा सम्पन्न सेवा दिँदै आएको छ ।‘ बैंकले पछिल्लो समय डिजिटल सेवालाई प्राथमिकतामा राख्दै दिगोपनामा पनि जोड दिएको छ । कागजी प्रक्रियालाई हटाउँदै, डिजिटल माध्यममार्फत सहज, छरितो र पारदर्शी सेवा दिने बैंकको प्रयासलाई उक्त अवार्ड प्रदान गरिएको हो । ‘प्रविधिलाई नवप्रवर्तनको शक्ति मानेर हामीले रूपान्तरणमा केन्द्रित रणनीति अपनाएका छौं, आर्टिफिसियल इन्टेलिजेन्स, डाटा एनालिटिक्स र एनबैंक एपमार्फत ग्राहकअनुकूल सेवा प्रवाहमा सुधार गरिरहेका छौं,‘ ज्ञवालीले भने । यस अवार्डले बैंकलाई अझ चुस्त र प्रविधि केन्द्रित सेवा प्रदान गर्न प्रेरित गरेको उनको भनाइ छ । सन् १९८४ मा स्थापना भएदेखि नै नबिल बैंकले नेपालमा बैंकिङ क्षेत्रमा प्रविधिको प्रयोगको थालनी गरेको हो । "
